AccountName,gameId,isPositive,review,Polarity
Gyro,219740,Recommended,"there are 3 different stroytellers for you to chose from , cassandra classic where the challenge level increases over time in a classic style of games , pheobie chillax where the focus is more on basebuilding and the size and wealth of your village / colony increases the difficulty level but you have more time to prepare and recover or randy random where most of the rules don't apply and the rng gods have free reign to massively p * * * you off by swamping your village / colony with goddamn pirates that somehow manage to cut off the arm of my best colonist by punching them .",0
Jet,253230,Recommended,"you'll be using your dive mechanic for speed , extra length , dodging and many sections of platforming .",0
Kemo,294100,Recommended,this might not seem like an important gameplay feature but interaction with other characters is one of the main happiness modifiers .,0
SneakyFox,238460,Recommended,whilst a similar ( or indeed almost identical ) visual style has been used there are enough differences in the gameplay to set this apart .,0
tyranno,113200,Recommended,"in these randomly generated floors i've been randomly rambling about , you may find many things : enemies to hurt you , items to help or hurt you , shops , secret rooms found by blowing up walls , secret rooms hidden in secret rooms , and some twisted boss fights .",0
ChØppa,698780,Recommended,"jumping a few minutes of gameplay , a certain dark turn of event happen .",0
Ioplop,219150,Recommended,"now , the gameplay .",0
The Holy Sy,238460,Recommended,"guns make a lot of noise , often attracting the attention of other enemies and making them rush you , which can quickly put you in a bad spot if you run out of ammo .",0
Florp Incarnate,253230,Recommended,"despite being a much simpler game than df , i still felt that the combat was implemented better .",0
Nerd Koopa,219740,Recommended,"hat kid herself doesn't have much personality beyond cute and happy during most of the gameplay , but her character becomes more apparent in her diary entires , relic descriptions and the way she comments on various world objects .",0
MechMK1,253230,Recommended,"in addition to choosing which storyteller you like , you can also set a difficulty , which affects how much of a curveball they are going to throw you .",0
7.66E+16,219740,Recommended,5 gameplay 10 accessibility 9 notes overall rating is a combination of the gameplay ( mechanics and story ) and accessibility ( how the game includes deaf / hoh gamers ) .,0
MattotheInkling,253230,Recommended,"don't forget training cards the trading cards are very useful to warp places , getting items and defeating enemies .",0
Knal1991 - Saint,238460,Recommended,"still the game rewards you for being as reckless as possible , the more reckless you are , the longer your killing streak gets , the more points you will earn and the more weapons and masks will unlock .",0
Eddy63,219740,Recommended,"also one hare turned crazy and ran to my base ( monty python anyone ) it was an epic fight , seeing all my enemies neutralizing themselves .",0
ModdledGore,698780,Recommended,"rip lawrence ) stil in development moddable cons it can be really hard ai narrators will punish relentlessly hard to create colonists that are effective without negetive affect on the colony or themselves ( not really a con it keeps the game balanced but some may not like it ) still in development costs money tl dr : hard colony sim , lots of customizability and funny / infuriating gameplay , still in development , comparable to dwarf fortress .",0
Emalco,294100,Recommended,"rocket boots , different kinds of enemies , lot of blocks and minerals , meteorites , giant worms .",0
Jarago,238460,Recommended,there are also 5 difficulty levels to beat .,0
Hirosam,219150,Recommended,"no problem , there is probably something in the workshop that fixes it , or improves your gameplay .",0
emperortomato,253230,Recommended,"this is because stages are just short enough that once you find your rhythm on a level , you won't have too much difficulty repeating your previous successes .",0
MattotheInkling,4000,Recommended,"the arena stage is that you can enter that you have a full hp , if you open the chest and you get the items , enemies will pop out and you need to kill it .",0
goblin.queen,219150,Recommended,"i have to keep restarting , and since it is not a quick play type of game , in fact , it might take you weeks of gameplay to finally get to end game , ie .",0
Brutal Dumbass ☢,413150,Recommended,some take hours because they rarely drop and others cause the enemy is so hard to beat and you have to do it multiple times for it .,0
Orpheolus,113200,Recommended,"( neutral score ) , mostly because of that difficulty spike .",0
Meneldil,238460,Recommended,"there's about thirty weapons to use , from a beer can to a m16 or a frying pan .",0
The Mute Cynic,698780,Not Recommended,"weather events are also prone to happen , but are easier to combat if you have the right heating and cooling equipment installed .",0
millseric1991,238460,Recommended,i normally check the enemy's weapons to know what i a dealing with .,0
[MClan] meepindoofer1,253230,Recommended,"finally , the last vanilla class is ranger , this class utilizes an array of bows , guns , or even a rocket launcher , along with a high dexterity and movement speed to stay out of the enemies way .",0
Brahmin Herder,253230,Recommended,"you can customize the difficulty in many direct and indirect ways , from choosing an ai director to choosing a biome and elevation to start in .",0
Thrill,413150,Recommended,"i loved harvest moon and rune factory , but hm had gotten a little repetitive , and rf went a little crazy in its search for interesting new content , falling all the way down the crafting hole .",0
Sig,219150,Recommended,incapacitated enemies ( due to extreme pain or loss of limbs ) can be captured .,0
Mittsies,294100,Recommended,"during combat , you will usually draft each individual person and control them directly , otherwise your colonists will generally carry out their normal tasks rather than actually go out and fight the raiders .",0
Chum,219740,Recommended,"exploring the controls was a bit of a challenge at first , and figuring out the quirks of our protagonist's moves took some getting used to .",0
The Holy Sy,219150,Recommended,stages are completed when all enemies have been thorughly disassembled .,0
DG Dobrev,294100,Recommended,"selectable difficulty depending on the chosen storyteller , you have 5 difficulty levels that will shape your adventure , including a permadeath option that saves the game at regular intervals , and if your colony dies , that's it .",0
roolo,253230,Recommended,"i personally pretend these mechanics don't exist , so i don't keep count of my wealth , and i don't sacrifice people .",0
Carrot Tea Cake,253230,Recommended,"you essentially kind of psudeo control these pawns that don't have functioning brains , and you set up schedules , work priorities , all that colony simulator stuff .",0
UN0W3N,219150,Recommended,"from a pure gameplay perspective , it accomplished its intended purpose but it can still hinder the game's appeal to new players , as if the overwhelming variables and sheer amount of displayed information wasn't enough .",0
Guts3062AD,238460,Recommended,"steel stayed on his side of the colony , working away at his armor and weapons .",0
Vengyr,698780,Recommended,"more steamlined , but hey , not everyone has 15 years to add obscure mechanics .",0
The Mute Cynic,4000,Not Recommended,i was personally waiting a good four hours for a ai core to be on offer from a trader ( or for the supposed event to spawn so i could harvest it from the enemy ) .,0
Mellow_Online1,698780,Recommended,"it's more reliant on its stroy and while i do enjoy games with a good story , i at least like some element of gameplay to go along with it , but i can get by on a visual novel , if it truely has a story worth telling , is something unique and is something that is delivered brilliantly .",0
Alas,219740,Recommended,"a lot a byproduct of being as vulnerable as your enemies , a fact i like , coupled with somewhat clunky controls .",0
KingSchiebi,238460,Recommended,"every hit can kill the enemy , as well as yourself , and that's where the game becomes more of a puzzle where the engagement of a room has to be carefully planned and executed , similar to titles like super meat boy .",0
Sephiroth1204,413150,Recommended,you start off with almost nothing and have to build everything from weapons and armor to houses everything to decorate them from the ground up and the only limit is yourself .,0
Kynikosa,4000,Recommended,"skills can help if your able to make the best of weapons or the shoddiest of statues , it all depends on what your colonists specializies in , you can also improve a certain colonists skill by making him do the work but if he fails , materials will be wasted but skills will improve .",0
Draconicrose,4000,Recommended,"your people , pawns , have unique personalities which interact with each other and the game mechanics in a way that creates chaos or peace , success or failure .",0
CujotheWolf,238460,Recommended,the story and gameplay are like harvest moon .,0
thancock223,238460,Recommended,the turrets finish off the enemies and i start clicking to have my one standing guy rescue the others .,0
genkipro,219150,Recommended,"in rimworld , you take control of a small group of colonists trying to survive on a frontier planet .",0
HisDisciple,219150,Recommended,"hotline miami has a high difficulty level , so it is certainly not for everyone .",0
P1nk0,698780,Recommended,there are around 4000 items and 360 of them are weapons .,0
Mittsies,294100,Recommended,"df is an incredibly complex experience with virtually bottomless gameplay depth , while rw is a lot more basic by comparison .",0
forestfey,219150,Recommended,"it happened more than once , that a former mod only mechanic was implemented into the core game .",0
Wit,219740,Recommended,"many things were lost , the fire consumed all , including all the weapons left behind colonists felled by the inferno .",0
Tornik,294100,Recommended,"bosses , monsters , rewards , a large ( and i mean huge ) array of weapons , items , decorations , you name it .",0
derpman,294100,Recommended,"when a raid comes , get your combat pawns behind cover and let them fire .",0
Dan Schneider's Hard Drive,219740,Recommended,"you have to be a certain height above the enemy , as well as a certain distance from them , and that includes being too close .",0
send noodz<3,294100,Recommended,"there's multiple different stats , ways to farm , weapons , armors , etc .",0
Callcenter of the Void,294100,Recommended,"not only that but the difficulty gap between the some challenge ( aka easy , first difficulty is accurately named base builder ) and rough ( normal ) is absolutely massive .",0
Farrowmorne,219150,Recommended,"the order of gameplay is as follows : start new game , get minerals , fight boss , get stuff and be op , get wrecekd by new mode , get minerals , fight boss , get stuff and be op , and then get just wrecked .",0
Godot,413150,Recommended,"those who have played games such as harvest moon , rune factory and , to a lesser extent , animal crossing can draw immediate parrallels between the gameplay and mechanics found in this game .",0
[BE]MalachiAD,219150,Recommended,"on top of this , everything is single hit death ( on you , and on your enemies ) so the masks you acquire as the game goes on need to be chosen strategicaly sometimes to make levels more managable .",0
Crimson-Albedo,219740,Recommended,the theme is different for each act and the mechanics and goals vary in each chapter .,0
LS-Kun,238460,Recommended,"you also have plenty of weapons to use , from blocks of ice to freeze your foes and boomarangs to stun them to grenades and frog bombs to blow them to bits .",0
Midouri ミリ,253230,Recommended,"i may have stated the gameplay is fun , but it isnt without issue .",0
Terminal Guy,219740,Recommended,"scavenge for resources , build tools and items to make life easier and fight not only enemies , but for your sanity , too .",0
genkipro,219150,Recommended,"you select a landing point on the planet based on a number of variables , such as climate and topography , and then you're on your own , with between one and five colonists under your control , ready to start a new life .",0
MVBlake,219740,Recommended,"the former hang around your base and charge silver for items , the latter charge your defenses with increasingly worrisome weapons .",0
genkipro,219740,Recommended,"you don't normally directly allocate colonists to take actions , but rather you control them indirectly through the work roster , where you can prioritise certain actions over others separately for each colonist .",0
DG Dobrev,219150,Recommended,"huge learning curve if you are just starting rimworld , i would suggest you play at a low difficulty level and get used to the game as much as you can .",0
Hobo,219150,Recommended,"the game holds some replay value with a hidden puzzle to collect pieces for and the fact that it's an entertaining gameplay formula regardless of story , but i can only help but feel like another couple missions wouldn't have hurt .",0
alsoandanswer,253230,Recommended,"the game is as fair as you want it to be difficulty can be selected , but the default is brutal dwarf level type of brutal .",0
Shadeem,253230,Recommended,"towards the end of the battle a thrumbo ( a large powerful and fast animal ) wandered into the battle area and was hit by one side , i suspect the enemy but cannot be certain .",0
Epix Sky,219150,Recommended,buy the game in a bundle with cs : ' s if anything in case those who plans of buying gmod doesn't have cs : ' s ( unless you enjoy looking at purple and black checkered textures all over the place with question mark items / weapons ) .,0
totallynotjon_,253230,Recommended,the gameplay is very reminiscent of mario's early forays into 3d platforming with chapter based encounters .,0
i need a girlfriend,4000,Recommended,"2 : oh cool so much bosses , mobs , residents fun , cool weapons steeper muynkrufta 1 .",0
Rurik,294100,Recommended,i expect much more unclear stuff later battle mechanics has big random factor .,0
Andrew_Bishop,698780,Recommended,"girls are pretty and interesting , gameplay is common for dating sim .",0
psychedelic dave,219740,Recommended,"the binding of issac is a very different game , but pulls off being weird , in concept and gameplay .",0
UN0W3N,219740,Recommended,"for most players wanting to grasp rimworld's mechanics without the feeling of accomplishing a chore , pick locations within a temperate climate .",0
gretgor42,253230,Recommended,"then , of course , there's the gameplay .",0
Slim Shady,219150,Recommended,"if he makes enough kill combos , is bold enough , acts quickly and other devious ways to devastate people , he will be awarded with new weapons and animal masks .",0
B∞mer,219740,Recommended,"she can twist and turn the world she inhabits to her desire , and she uses this knowledge to gain control over the story .",0
RubyHazel,253230,Recommended,"the raids wasn't too bad , because of my many colonists it was easy so i changed the difficulty to rough , and randy send me a volcanic winter ( taken from the wiki : solar panels will not produce as much power .",0
Duskylyon,253230,Recommended,which brings me to gameplay .,0
Belmont,219150,Recommended,they can also be thrown to stun most enemies .,0
Pseudonym?,238460,Recommended,"i also think that sometimes i d prefer more than 2 weapons to switch between while playing because you often need a lot of different weapons for one level if you're trying to cut corners and save time ( or trying to solo the co op levels , many of which are thankfully possible solo by abusing the weapons ) , but more than 2 might have made it difficult to get the right weapon anyway .",0
ChristofOtiz,253230,Recommended,"melee weopons produce no sound , and killing with enemies won't alert other guards within an earshot .",0
"ok, liberal",4000,Recommended,something happened next that i wouldn't wish on my mortal enemy .,0
The Holy Sy,219150,Recommended,"take advantage of your surroundings by luring enemies into narrow corridors and mowing them down with gunfire , or waiting for them to walk by the corner where you eagerly await with your meat cleaver held high .",0
Leviathis_Krade,253230,Recommended,"the recent update screwed up bat and slime movements causing them to glitch through areas they should not be able to like a mother slime one of the bigger ones can now move through 1x1 spaces and the bat spawn rate increased so much i was swarmed by 30 bats just below marble level , and the weapons were significantly nerfed as were the baddies given at least 10x more hp , but i might of done something when creating the world when dealing with that .",0
Orpheolus,698780,Recommended,"craft stuff , make super weapons to slay enemies , build in a block format and has some multiplayer .",0
Eddy63,219740,Recommended,the difficulty is customisable both by choosing a different story teller hardness but also by choosing a biome .,0
Mellow_Online1,698780,Recommended,"one of the ways you can impress the girls is by writing poetry , which is the game's only form of gameplay occupant in which you're given a selection of different words and as you learn more about the characters and learn more about their personalities , these words will have positive effects on each of the characters , so if there is a specific girl that you're wanting to impress , you have to really pay attention to their likes / dislikes , personalities and attributes .",0
chaser_r2,219740,Recommended,"involving a variety of management genres ( combat , construction , crafting , etc ) , this game is heavily reliant on strategic planning and decision making for survival .",0
exiletexan,219150,Recommended,"maybe your best gunman loses an arm in a shootout , and you have to send your cannon fodder colonists to retrieve him and hold off the enemy while your medic does what he can do get him back into the fray .",0
Yossarian the Assyrian,4000,Recommended,"its mechanics are similar to katawa shoujo and steins gate , though its story is much , much different .",0
vladde TF:GO,219740,Recommended,"but it's all the same for your enemies , which makes planning and strategizing way more important .",0
IcerOut,253230,Recommended,"just how much content does this game have well , over 500 unique enemies ( from slimes to floating eyes , from unicorns to homicidal snowmen ) , 360 weapons ( ranging from swords , boomerangs , guns and bows to yoyos , bunny cannons and nyan cat swords ) , 78 full sets of armor ( and tons of pieces which don't fit into a set , plus loads of vanity items and costumes ) , 36 different bosses , and 10 random events , all with unique enemies and loot .",0
Stormo,698780,Recommended,"you can manually command colonists whenever you want , or even take full control of them when you need to give them detailed orders , for instance when they need to defend against a raid .",0
CaptainBullitCushion,4000,Recommended,"you can set it to a hard level , but i like to set it on base building mode , which is just the second hardest difficulty level .",0
The Mute Cynic,698780,Not Recommended,five difficulties are also present and range from less combat with a focus on construction to continual raids while struggling to maintain a growing colony .,0
Belmont,253230,Recommended,melee weapons can be swung or thrown .,0
Exelus,294100,Not Recommended,"not fast forwarding ) gameplay comes from random events generated by the storyteller , an a .",0
Logan,219740,Recommended,"that's a really big part of a game and gameplay hats in game have different unique abilities , and you will need them the further you go .",0
Mandamus,238460,Recommended,we put him down with energy weapons .,0
Jarago,698780,Recommended,everyone ( even enemy attackers ) have their backstory which informs you what the person used to be before landing on rimworld these backstories may sometimes affect their skills levels and traits .,0
ショタ男の娘,698780,Recommended,after playing for a while you start to get a feel for the enemy patterns and how to deal with them .,0
Gorgo the Orc,219740,Recommended,"combat in this game will have you still using the abilities that you use for platforming , so no 3 hit combo here which is because most modern 3d platformers fail to remember that it is a platformers first , and a 3d beat em up last .",0
Bushwacker,238460,Recommended,"if you want to and you think you are up to snuff , you can siege an enemy town , picking off bandits with precision down to the finger .",0
Mandamus,253230,Recommended,walsh gets better and both he and young are fully equipped in nano armor with energy weapons .,0
Dan Schneider's Hard Drive,253230,Recommended,"some areas require you to use certain context sensitive actions , such as using a homing attack on an enemy or using your hookshot .",0
Cap'n Alex,238460,Recommended,"the game is rage inducingly difficult , but as you complete the levels and obtain new masks and weapons the game becomes slightly easier ( still very difficult though ) .",0
masterxodin,105600,Recommended,"i had heard it was a little bit like 2d minecraft ( which i had never played either ) , and after sitting on the fence for awhile and watching my friends rack up over 100 hours of gameplay on it , i decided to buy the game .",0
B∞mer,238460,Recommended,seeing what you think are the results of your actions spin out of control in front of your eyes becomes increasingly nerve wrecking as the events that unfold become more extreme .,0
Daedalus,253230,Recommended,"there are masks that are clearly better than others , while some are there just for fun or added difficulty .",0
Knal1991 - Saint,253230,Recommended,all weapons are throwable ( so far atleast ) and it is an option you will utilise almost always .,0
Edock,698780,Recommended,"there are plently of weapons to choose from cool buildings to build perfect game to play after a long day of work you can decorate your house to make it home there is going to be a new patch soon you start of poor , however after a lot of hard work you can make a name for yourself wide variety of npcs that each have a distinct personality .",0
ショタ男の娘,219740,Recommended,"after you start getting to know enemy patterns you need to understand what the items do ( some item descriptions lie ) , and which ones you might consider skipping .",0
TheDarkOcarina,238460,Recommended,if you ever get bored of your weapons and maps you can download weapons and maps from the community .,0
UN0W3N,294100,Recommended,"you can choose the more relaxed nature of a storyteller which will allow you to build up your base , see your colony prosper unchallenged by raids or cruel weather effects and once you feel like you're ready to up the ante , switch to a storyteller of increased difficulty and more random behaviour .",0
Rurik,294100,Recommended,"but people who likes relaxing and slow gameplay with low amounts of actions needed , who likes to see how the base grows and you get stronger army then get it .",0
Vampyri,294100,Recommended,"this mechanic would be frustrating in a game that doesn't offer some other form of progression , and tboi clearly understands that .",0
Great Hero J,294100,Recommended,"rimworld , being a sandbox game , is also perfect for modders to tinker around with existing mechanics or let their imagination off the leash and create something awesome .",0
Eddy63,219740,Recommended,and it's not always the enemy attacks that will kill you .,0
CULT|infernovia,219740,Recommended,but combat isn't all there is to this game .,0
LeGit,238460,Recommended,it made me laugh out loud one moment and then painfully squirm in my chair the next all with a game where 90 of its gameplay consists of the occasional left click .,0
KeekLaH,219150,Recommended,and it literally has years of gameplay .,0
FleetCommand,219740,Recommended,"you control hat girl , who as you learn in the first minute of the game got stuck with her spaceship and have to collect time pieces ( in the form of hourglasses ) to be back on the road again and head home .",0
Stormo,698780,Recommended,"occasionally , enemy factions will attempt to raid your settlement , and you will need to keep evolving in order to withstand their ever strengthening attacks .",0
Crimson-Albedo,219740,Recommended,sometimes platforming mechanics can seem difficult .,0
OblivionPenguin,219740,Recommended,"drafting your colonists isn't the only way to get them to fight , but it the one instance in which you directly control what they do and where they move .",0
JaguarUSF,219150,Recommended,"hostile enemies will invade , so defenses must be constructed ( the game utilizes cover ) prisoners captured after a raid can be incorporated into society or harvested for organs ( among other options ) .",0
UndyingCrystal,219740,Recommended,"food rots , weather changes , the daylight fades quickly , and as you go on , hounds and other enemies will hunt you down .",0
[GC]SpiritWolf,219150,Recommended,"you die , craft , defeat bosses , explore , build and with it's fairly recent update before a terraria 2 was announced , it added quite a large amount more of items to craft , including weapons , armor and just decorative stuff , ontop of that it added new bioms and a new set of bosses and what not .",0
Slaiyn,4000,Recommended,each run the player is confronted with a randomly generated arrangement of rooms containing a wide variety of enemies and traps .,0
