AccountName,gameId,isPositive,review,Polarity
Bironic,698780,Recommended,"1 ) the gameplay can get a little repetitive but it's all really relaxing and calming and there's almost always room for more improvement ( and if that's not enough , you can add some mods to spice it up ) .",1
wario,219150,Recommended,definitely worth a buy if you want mindless violent fun with an interesting stealth mechanic .,1
unreasonably girthsome doinks,219740,Recommended,"this epic 2d platformer offers a special type of combat gameplay , that i haven't experienced in any other game , and huge amounts of items , mobs and bosses that make minecraft's vanilla content look pre alpha .",1
MechMK1,219740,Recommended,"all in all , i consider this game to be easy to pick up , if you do not go overboard in the beginning and settle in the middle of an ice desert on extreme difficulty on your first run .",1
Deph Pyro,413150,Recommended,"we got another new biome , a stubborn boss , more weapons and .",1
Slim Shady,219740,Recommended,": ( even after the game , there are multiple masks and weapons to unlock afterwards .",1
Vontes,238460,Recommended,a lot of community maps to keep those gameplay hours running .,1
standox420,253230,Recommended,"i am giving this game a ( good score ) there are a few things i am still fumbling with as far as controls and understanding how to keep pets from walking inside and outside of my houses causing dirty floors , i also am struggling with animals that self tame that you want to release from your care that don't seem to vacate as you free them .",1
"WELCOME, THRILLHO",238460,Recommended,"building your base and crafting are very entertaining , combat is fast paced and varied , many items have quirky but powerful utility not always obvious but very rewarding when discovered .",1
Xaelon,294100,Recommended,"take solid sidescrolling combat ( with screen filling bosses ) , combine it with minecraft esque digging and building and then add a ton of sweet loot to find and you'll have terraria .",1
Stormo,4000,Recommended,"another nice touch is that instead of simply choosing from a shortlist of cookie cutter difficulty levels like easy , medium , hard , rimworld also offers you several narrators to choose from , who don't really make the game harder or easier , but different .",1
BeardedButt,294100,Recommended,best harvest moon clone yet it even has some things taken from animal crossing yes i recommend : ) pros : everything except for 2 things cons : the fishing mechanics need a little work having to face one way and click your mouse the same way for every action sucks .,1
althanaes,219740,Recommended,"early access review are you a compassionate , reasonable and well intentioned person who generally likes to see to it that people are taken care and prosperous then rimworld might be for you lead your colony of helpless pawns to a safe and better future build them quality furniture , fine meals , 24/7 quality medical care and all the joy objects known to man are you a sociopathic sadist , who enjoys seeing people suffer in whole or in part , here meaning that the people are either subjected to various degrees of suffering , or that the people are cut into parts and then subjected to the same degree of suffering , or that all of the people are cut into various parts , and then suffer in a 100 200 degree oven then rimworld might also be for you perform unnecessary surgery on your prisoners , feed their dead friends to them , or replace your peoples body parts with machinery build a terror inspiring dread citadel of depressing black slate brick cemented by the mortar of a thousand dead enemies , and become the city that even the pirates are terrified of do you enjoy gof nn lii ph nglui shog ot syha h lloigshogg rimworld ahornah llll ah ymg ahagl ah mods ot lloig ch nglui ahog n ghftlloig ng shogg naiiii mgn ghft ngnah fhtagn rimworld's got something for everyone .",1
GrayStillPlays,294100,Recommended,"you can choose a difficulty , a biome , a storyteller ( the style of ai when it comes to how challenges and boons come to your colony ) , and you can even generate your colonists .",1
psycosulu,219740,Recommended,"the gameplay was difficult at times but the responsive controls and quick respawns made death a thing to be learned from , not as a tool for punishment .",1
Kolo,219150,Recommended,"yes , some can argue that alot of the mechanics and concepts were there before , but they are put in such a great way that makes it one of the best games i've ever played .",1
Mr. Bear,219150,Recommended,"i did not come from a background of dwarf fortress of prison architect , nor did i believe that i would be a fan of the methodical and careful harvesting , construction and management that rimworld's gameplay prominently features .",1
DUDE_,238460,Recommended,"awesome soundtrack , great gameplay , buy this now",1
millseric1991,294100,Recommended,they all had great weapons for that point in the game .,1
Molon labe,4000,Recommended,"game will never get boring even in the mid and late game , especially if you'll choose challenging difficulty to spice up the gameplay with some action .",1
jc ham,253230,Recommended,"the gameplay provides a very special breed of tension and strategy , mixed with sheer reckless abandon .",1
The Best Guy,698780,Recommended,it has the capability to keep you at your computer long into the night with a very achievement based gameplay drive .,1
nope.,4000,Recommended,": p the amount of gameplay variety is enormous , there is farming , animals , power systems , an in depth health system , different skills , travel , planetary seasons , strange individuals and even a scenario editor that allows in depth customization of the gameplay .",1
Zyga,219740,Recommended,exactly what is this game the good : tight controls .,1
Zuro,219740,Recommended,"it's made to be highly replayable , with no two runs being alike in the way of found power ups and enemy / room layout .",1
Vultcha_,4000,Recommended,"i'm looking forward to further playthroughs with mods , different start conditions , and harder difficulty at some point , as well as eagerly looking forward to what further content gets added to the game so can say for me that replayability is high for the game .",1
bluemuppet,219740,Recommended,"an excellent example of a 3d platformer done right , with tight controls and camera work ( for the most part ) .",1
Dananuh,219740,Recommended,"the rooms are randomised every playthrough , which really gives the game a lot of replayability factor , because you never know what is going to turn up in every room , and that goes for everything ( bosses , items , general enemies ) .",1
KRAUSER-SAMA,698780,Recommended,"there are three essential difficulties known as ai story tellers , how can these diversify your experience simply put , the higher the difficulty , the harder this game will try to f * * * you up .",1
Nibbler,238460,Recommended,"the gameplay retains all the fun elements of harvest moon , plus making everything much easier to do by virtue of the mouse control .",1
Mimbsie,219740,Recommended,even after nearly 70 hours of gameplay there is still so much more left to be discovered in this beautifully immersive world .,1
DuoKidd,219150,Recommended,the terraria experience : create character build a sweet house find a large tree with loot under it make my house better with loot head underground find sweet ores and minerals cheese your way through enemies with throwing knives and shurikens meet friendly skeleton merchant whose too expensive for you take 3 steps to the right die to boulder trap and lose gold ( good score ) sweet game full of content to waste many hours on,1
MaarteN,698780,Recommended,"challenging , the game keeps you at a constant pace of difficulty to keep you satisfied and not bored , although there is an option to change that for example the randy random mode .",1
Not Legato,253230,Recommended,"it controls like a dream , for a 3d platformer .",1
Stoppy,219150,Recommended,"awesome , rage inducing , gameplay .",1
KingxMiller,253230,Recommended,"2 d minecraft with more features , bossfights and hours of fun gameplay .",1
Agent Cat,698780,Recommended,if you dare to play it again you'll realise that it goes to a whole new level of difficulty ( 2 more levels to be precise ) .,1
Mr. Bear,219150,Recommended,"when i first booted up rimworld , i sat down with a glass of ice water and familiarized myself with its core gameplay mechanics .",1
Hopesedge,4000,Recommended,"gameplay ( good score ) : there are different types of games so i'll elaborate , for the style of game this is ( a sci fi colony sim ) i d say the gameplay is near perfect , and it can be perfected to a player's liking with mods , a lot of features from popular mods are incorporated into the game over time so the base game's gameplay will get even better over time .",1
SKdaGamer,105600,Recommended,there is so much variety in the worlds and gameplay and you can go through the story a different way every time .,1
DaHedgehog27,294100,Recommended,"this is another top seller for a reason , gameplay is challenging and fun , worth a try if your into sim games .",1
muscle toad,253230,Recommended,it took us till 2k16 to get a farming / mining / combat / fishing / animal crossing sim that you can be gay in ( good score ) 3,1
nope.,253230,Recommended,"its learning curve is surprisingly steady , you dont need 500 tutorials to even start playing and there is an intelligent learning helper that teaches you most of the mechanics on a need to know basis , so you dont get overwhelmed .",1
dref,294100,Recommended,"yet , i've been slaughtered in so many different fun ways , that i can't refrain from trying again and again : ) rimworld shows a very robust gameplay , and lots of potential .",1
NeoSoper,219740,Recommended,the controls and movements are tight .,1
Internet Ham,219740,Recommended,the variety of weapons at your disposal make every level intresting to say the least .,1
Mr. Jackpots,4000,Recommended,"the randomness of rooms , enemies and items you get each time really adds up for the replay , which is basically infinite .",1
Sensual Zombie Fanfiction,219740,Recommended,"the story teller is very interesting and tries to fit all different playstyles / difficulty theres a story teller that makes it more of a building game , theres still dangers but you get alot of time in betweeen events to build .",1
cLN_christianmingle.net,294100,Recommended,"endless hours of gameplay , tons of unique floors and opportunities .",1
Kovac,238460,Recommended,"i would 100 recommend this game , it has fantastic gameplay which challenges you but at the same time doesn't feel unfair in anyway at all .",1
100% Hippo,219740,Recommended,"you control the camera , and i never had issues with camera angles obscuring vision .",1
FamelessFace °_°,219740,Recommended,with its distinctive look and unique gameplay it offers a good 10 hours of casual mayhem .,1
S1X BULL3TS,253230,Recommended,"update : i was a little disappointed with hotline miami two , but still loved the story and gameplay of both games .",1
Ultranator Plasma-Blast,253230,Recommended,the variety of weapons is enormous as well as armor accessories .,1
Fabio,294100,Recommended,"the good : the bad : progressive and ever expanding survival experience that plays and feels organic solid and practically bug free game mechanics indepth , powerful social interactions between the characters and interactions overall endless replayability , charm , difficulty flexibility and entertainment extremely active modding community whose imagination and talent will fill any gaps ( content / mechanic wise ) you think the game has .",1
Ahmysin,238460,Recommended,"a bit difficult to control sensivity of mouse with the movement , since the crosshair also moves with the players movement making the game a bit hard ( ohhh i've died 100s of times ) but overall awesome",1
☾SpookyRedPanda - ダーク☾,219740,Recommended,"along with the time pieces , there is also garns that you use to upgrade your hat different hats in the game give different abilities , so get those garns to unlock more awesome abilitis and look fabulous at the same time ) the controls are extremly smooth and everything works really well into each other .",1
crankypopcorn501,219740,Recommended,"persoanlly this game gathered dust on my wishlist for a long time , i didn't really care for the character design of some of the enemies ( mafia ) and i was worried this would detract from the game , but once i got to playing i was taken over by the charm of the worlds and the various upgrades along the way .",1
Leveler_,253230,Not Recommended,"there's a decent variety of worlds , characters , and gameplay .",1
5katz,219150,Recommended,"early access review its a great game with many many days worth of gameplay even in vanilla , and a gigantic modding community , there are so many mods and so much new stuff always to explore , this never gets old , in my 2000 + hours i still havent seen everything and i am experiencing new events almost every game , truly worth 30 bucks ( good score ) tynan pls make pregnancy a thing",1
Geode890,105600,Recommended,"this game is an interesting variation of the 2 d building genre , as there are extensive variations and amounts of enemies , as well as bosses , that create a fun battle experience .",1
Foxxys856,294100,Recommended,"this game is fantastic i have over 1200 hours and still going strong one of if not thee best games in its genre and the modding community is amazing as well this game stands brilliant without mods but the longevity and replayability is near endless with mods and if thats not enough no single gameplay is the same i honestly think this is one of those games that just gets better and better and the dev ( single man ) is very active i watch cohhcarnage on twitch alot and he is always on his chat for me this was the best money ive ever spent and i carnt wait to play more any dlc for this game if it was to come out would 1000 be worth the money and in all the game play is easy to pick up the music is immersive the easy of the controls even the panels to locate what u need its all simple , from the mods the ease to master this game the unlimited play styles the game char even the raiders and attacks and random events you will not be dissapoinited at this buy i can and will say this is the best game ive ever played just to add this game now beling relase this is a game that should be in everyones steam libary deffintly worth the full asking rpice no matter what i love this game and carnt seem to put it down : )",1
Ixo,238460,Recommended,the gameplay is challenging but fun .,1
Poon Conquerer,4000,Recommended,"the atmosphere , the items , the characters , and the huge variety of enemies and bosses are what makes this game so great , and it will have you playing it over and over again .",1
Comrade Stalin | trade.tf,219150,Recommended,"its a whole new level of gameplay , and throws in so many options or ways to play .",1
Soriz,413150,Recommended,"plenty of adventure , combat , and at the end of the day , return home to relax or even stay at home a few days to work on the property and recoop yourself .",1
Raven Lynx,253230,Recommended,the controls for the game are great you can use a keyboard or controller to play the game .,1
Great Hero J,698780,Recommended,it uses a custom made combat engine and a deep medical system that work in tandem to make every fight feel intense and every affliction feel meaningful .,1
[KBMOD]MuffinTheKid,219150,Recommended,the small intro is enough to grab your interest and the gameplay takes control from there .,1
Xars Evandor,294100,Recommended,nice game with tight controls and great gameplay : d,1
Duncan,219740,Recommended,this means that there are hundreds of excellent mods available so you can get the gameplay you like customised for yourself .,1
Internet Ham,238460,Recommended,the 16 bit style mixed with the amazing control and gore make this a classic for gamers who want a challenge with a reward .,1
AestheticGamer,253230,Recommended,"i feel the game's controls are going to have some mixed reactions , but i actually really like them .",1
NickLuigi,253230,Recommended,"there are new enemies , new bosses , and new environments that other games in the mario series don't have .",1
butt_hash,219740,Recommended,"luckily , it feels great and with a little practice you can have complete control of hat kid and her abilities .",1
Dr. avocado,4000,Recommended,randomly gernerated levels makes it like the game is never being played twice and over 15 + hours of gameplay i highly recommend this game plus it's 5 ( cheap ),1
ruNb4its2latE,253230,Recommended,"snes harvest moon modernized with farming , crafting , leveling , and combat .",1
roolo,238460,Recommended,"but nowadays , threats keep adapting to you , and as long as you pick the right difficulty , you'll always feel on edge , or at least find yourself preparing for the next threats .",1
jbtheskater,238460,Recommended,"the gameplay : it's precise , fast , fluid and compelling .",1
xenokingdom,413150,Recommended,"it's very accessible to new players unfamiliar to the harvest moon type gameplay , and is incredibly fun to boot .",1
funnyboy08,238460,Recommended,loving the combos and different masks which create an unique gameplay .,1
Mevvallanneous Bob,219150,Recommended,"as stated earlier , by principle of playing the game , you learn the ins and outs of the controls fast .",1
dancinbuddha,4000,Recommended,"if you enjoy additional control over the creation of your colony , or if you would liketo add in more options and asthetic possibilities the mod community is very active and i have added 40 + playtime hours and counting with the ones i've downloaded .",1
jc ham,253230,Recommended,"it starts off relatively simple as you get a grasp of the confusing and trippy world you've been thrust into one or two enemies here or there , no problem .",1
KT_Extinction,238460,Recommended,"this game has been in development for years and it shows , there are plenty of features and mechanics in this game , as well as a distinct lack of bugs ( so far ) .",1
BoundlessEcho,219740,Recommended,stunning gameplay mechanics make for an entirely new type of game .,1
Egregious Tophat,238460,Recommended,everything from the narration to the actual gameplay itself is enjoyable and you never feel bored with it because of all the player made levels .,1
Himiko Toga,253230,Recommended,"no part of this game is dull or repetitive , and every level tries something new .",1
Chunderfield,253230,Recommended,"the randomly generated levels , enemies , items drops and bosses makes boi extraordinarily replayable .",1
Ioplop,253230,Recommended,"god , the gameplay is just great , almost perfect .",1
Kevelinu,253230,Recommended,"so what aspects stand out in this game one important aspect that will have a lot of influence in the enjoyment of a game like this , the controls and they are perfect they just feel natural and you are just in control .",1
IncongruousGoat,413150,Recommended,"at only 10 dollars , the value one can get out of the gameplay is astounding , and the game is certainly repeatable , as each time through the adventure is different .",1
ChristofOtiz,238460,Recommended,"though going in guns blazing is often a one way ticket to a restart , the times when it actually works out produce some of the most frantically satisfying gameplay in any digital medium , full stop .",1
ok retard,219150,Recommended,the way the levels are made in such a way that it makes you step out of your comfort zone to make you think differently in certain situations never making a level feel repetitive and dull .,1
Farmy,294100,Recommended,"wow a few hours into the game and i am impressed , a lot so if you are in to your typical farming games like farmville , farmtown , royal story and so on then you will love this but it's more than a farm game , it has some very interresting and intriguing side quests , a very good fishing mechanic and a great social side as well .",1
Jorrrrrn,4000,Recommended,"the mechanics of the game are simple enough that you can keep yourself amused with minimal effort , but detailed enough that you can micromanage everything down to when your colonists eat lunch .",1
SnaggleTooth120,113200,Recommended,"the 2d mechanics are great and it is very diverse in terms of weapons , enemies , and building materials .",1
Zyga,253230,Recommended,"theres so many ways to complete everything in the game too , the speedrun strats of this game are a ton of fun , but thats not to even say that everything is mindlessly easy either , in order to do a lot of the cooler things you should be thinking outside of the box and should have a good grasp on how to control your character .",1
appelpie,219740,Recommended,"the numerous amounts of masks and weapons within the game , along with all the baddies and bosses , make the game even more exciting and intense .",1
forestfey,253230,Recommended,"5 difficulty settings , 3 so called storytellers and editable aswell as creatable scenarios offer a custom tailored experience catering to ( almost ) everybody .",1
Internet Explorer,238460,Recommended,"* customization everything can be changed whether it be with a gameplay mechanic or simple mod , it can be what you want it to be .",1
Enderkick,238460,Recommended,"the dialouge made me laugh and the controls are simplistic , great game .",1
Doomer Maximus,219740,Recommended,"however , i still enjoy a hat in time immensely and i really enjoy its very fun mechanics .",1
Tzion,238460,Recommended,( good score ) on controls .,1
ZedXtreme639,219150,Recommended,"the gameplay is great , there are plent of bosses , and you can join others who play this game .",1
masterxodin,413150,Recommended,"its multiplayer feature did require me to fiddle with my network router a bit to ensure there was an open port for others to connect through , and that was a bit of a frustration , but ultimately it worked out and it has provided many hours of enjoyable gameplay with friends .",1
Anderleit,294100,Recommended,"it boasts endless replayability , enthralling gameplay , and comedy so black it's grimdark .",1
PapeMaster TTV,253230,Recommended,always random and very addictive with high difficulty i really like it,1
JMalm,253230,Recommended,"it's not too terribly long , but there is a good amount of replay value with unlocking all of the masks and weapons which offer different strategies for each level .",1
ThatSoda,4000,Recommended,"easy game mechanics to pick up / newb friendly i give this game a ( good score ) , with mods : ( good score )",1
boyflea,253230,Recommended,a wonderfully assembled visual novel with some superb story mechanics .,1
BevaBanzai,219150,Recommended,"few to none bugs , a bit of z fighting but nothing else that i have noticed during my 70 hours of gameplay .",1
hayhaygass22,219150,Recommended,it is a really good game and is really easy to learn the controls .,1
mcpretzel,253230,Recommended,the atmosphere and the gameplay tie together to bring forth truly amazing experience .,1
BevaBanzai,113200,Recommended,"it's pixelated , it was very little in the way of a story and it's quite repetitive but oh how i love this game it has such a harvest moon feeling to it and i didn't know i craved that before i stumbeled onto this title .",1
CarrotCase,413150,Recommended,"with a hidden storyline , imaginative enemies and bosses , and a huge world of different biomes to explore , terraria is truly a game that is hard to quit .",1
cheepi pls,219150,Recommended,"the number of guns and melee weapons you can unlock is quite intriguing , as well as the masks .",1
Sazaraki,294100,Recommended,great gameplay with awesome enemies and items .,1
Kat,219150,Recommended,extensive difficulty levels + different ai storytellers ( decides what random events and when ) different biomes that result in gameplay changes required .,1
keylocke,294100,Recommended,"early access review i've been playing this game since the early alphas and the thing i like about it the most , compared to the other colony sims , is it's rts based battle mechanics .",1
Turnippz,219740,Recommended,"what can i say is a behemoth game , they always make such original , funny and entretaining content , the story is great , funny and original the gameplay is awsome and the co op is very well executed , i truly recomend battleblock theater ( good score )",1
anaid,219740,Recommended,"you're smearing the painfully purple carpets with blood of mobsters as you , some nameless masquerading dude , go through apartments with only one goal in mind : kill everyone else and get a nifty high score the core game mechanics are unforgiving , quick paced and ramps up nicely .",1
Great Hero J,4000,Recommended,"rimworld is one of those games that doesn't look like much on the surface , but once you start playing , the sheer complexity and attention to detail of the gameplay itself will blow your mind .",1
Andrew_Bishop,219150,Recommended,"if it's all about you , welcome to literature club doki doki is short dating sim with an interesting mechanic .",1
masterxodin,113200,Recommended,"hundreds of hours of gameplay later , and i have to say this is possibly one of my favorite games of all time .",1
DataSage,294100,Recommended,"farming , livestock , fishing , mining , monster slaying , romance , relationships , memorable characters , an intuitive ui and control scheme , fine attention to detail , an easy and sensible crafting system , and a logical and fitting progression that is mixed with thoughtful dialogue and nice little easter eggs that will make you chuckle all come together for an outstanding experience that will make you wish that this game could go on forever .",1
ChristofOtiz,238460,Recommended,and yet hotline miami also brings the bacon in terms of gameplay as well .,1
