AccountName,gameId,isPositive,review,Polarity
Dan Schneider's Hard Drive,219740,Recommended,"Despite its child like visuals , A Hat In Time was created for adults who enjoyed Super Mario Sunshine's secret levels , Psychonauts , and The Wind Waker .",1
Duncan,219150,Recommended,"This game is kind of like dwarf fortress lite , it is simpler and better looking than DF , but has similar gameplay concepts .",1
EndoNerd,113200,Recommended,"Remember the days of Harvest Moon SNES How incredibly awesome the gameplay was The graphics were spot on and soothing If you are looking for a game like Harvest Moon , look no further .",1
jstubbles,219150,Recommended,"it's an understandable opinion , with it's cutesy graphics , and clean , almost clinical interface , it's easy to mistake the game for something a child would play .",1
JustCamille,4000,Recommended,"This is a game I can certainly recomend Cutesy graphics , gorry in spirit , this game is here to provide you countless of hours of entertainment .",1
literalIlliterate,4000,Recommended,"The control works great , the vibrant colors look amazing , and the people are interesting and three dimensional .",1
Ohaiyo Oppa,4000,Recommended,"The Graphics of the game , relatively same to Half Life 2 the gameplay mechanics are different and it gives the game a brand new experience everytime you hop into this addictive , fun to play , sandbox game .",1
Ohaiyo Oppa,219150,Recommended,"I would give it a ( bad score ) due to the unrealistic graphics and sprinting animations ( REMEMBER YOU CAN ACTUALLY ADD MODS ON THE WORKSHOP INTO THE GAME ) Now , For the gameplay In Garry's Mod the game is full of Gamemodes such As TTT ( Trouble in Terrorist Town ) Prop Hunt and much more This game gives a better feel to sandbox games ( Instead of old lame Minecraft ) All and All i would rate this game : ( good score )",1
Pontifex Maximus,4000,Recommended,"It combines colorful , detailed graphics , along with engaging game mechanics .",1
Reloading,113200,Recommended,"The graphics and gameplay bring strong comparisons to the Harvest Moon series , and this game is nothing , if not a love letter to that game and its ilk .",1
SpringRat,219150,Recommended,Don't let the lame graphics put you off this game is all about gameplay .,1
Valkhellas,4000,Recommended,"it's a glorious , disturbing , bloody , frustrating mess of wonderful gameplay ( if not with a few bugs , in both sense of the word ) , twisted visuals , and a scryptic , vague story just enough to create mass speculation on metaphor and representation .",1
Aeri,413150,Recommended,"This is the perfect nostalgia sandbox MMO for those who love old school style graphics while building , crafting and exploring .",1
Ōkami-Irelia: Queen of the Sky,238460,Recommended,Playing the game for a few minutes will make you realise that the quality of visuals and gameplay are quite detailed and advanced for the average indie developer .,1
♛Greenrune113✚,238460,Recommended,"You can alter all you want , and the good thing is , it's super easy and you don't need to pay people anyting to test it out for you + Great game + Great FPS for even the crappiest laptops + Great graphics + Ability to own and host your own server ( starter coding ) + Great community + Lots of gamemodes so you don't get stuck with one boring mode",1
Ben-zo,253230,Recommended,The gameplay is platforming at its best and the artstyle is beautiful with amazing visuals .,1
Canman,698780,Recommended,My roommate had a hard time understanding how I had become so invested in the world and story represented on screen in the game's Spartan graphics .,1
*Furious Train Whistling*,219740,Recommended,"The music is great , the gameplay is phenomenal , the story is .",1
:wq,253230,Recommended,"Gear with Breakfast has also put up the full soundtrack on YouTube , so go check it out The platforming is solid .",1
@uRoN,219150,Recommended,"This game is pretty easy conceptually , but everything looks great , from gameplay to soundtrack .",1
[Panteri] Skukuy,253230,Recommended,"The gameplay is fun and smooth , the sound quality is top notch , and Stampers voice ( The narrator ) is pure sex to my ears .",1
51JBerger,219740,Recommended,"A must buy 3D Platformer that has very fun gameplay , great characters and an awesome soundtrack .",1
A Real Kneeslapper!,238460,Recommended,"But , from what I've played , I can tell you exactly what it does and doesn't have : Pros : * Replayability to the extreme * Godly music * Really enjoyable boss fights * Sense of progression * Almost unable to qUIT IT * Lots of classes and unique weapons to choose from * Many mods to choose from if you get bored of the main game * Able to choose how you want to play the game , i .",1
A Real Kneeslapper!,219740,Recommended,"But , from what i've played , I can tell you exactly what it does and doesn't have : Pros : * Replayability to the extreme * Godly music * Really enjoyable boss fights * Sense of progression * Almost unable to qUIT IT * Lots of classes and unique weapons to choose from * Many mods to choose from if you get bored of the main game * Able to choose how you want to play the game , i .",1
☂︎ Orbfer,4000,Recommended,"The most disturbing game i ever played , smart way to make horror in the game and very good music .",1
Aavak,219740,Recommended,"Rimworld also boasts some amazing audio assets and impressively atmospheric music that really helps to set the mood in the game The difficulty is highly customisable , and combined with the detailed scenario editor , allows you to tailor each game to suite your particular skill level .",1
Ace Inkwell,253230,Recommended,i have to say this game wins hands down the music is amazing and the gameplay is just great i use this game if im fealing P .,1
Ashley Heart,253230,Recommended,"This game is amazing , a must buy everything from the platforming to the cuteness OVERLOAD this game has had me smiling from the very start , and to top this lovely cake Is the awesome levels , great soundtrack , and Hats ALL THE HATS , so would I recommend this game The answer is YES",1
b,253230,Recommended,"Positive : The music , art , and characters make A Hat in Time an adorable 3D platformer that is all age appropriate in terms of content and difficulty ( though some levels might prove to be challenging for younger audiences kind of like Super Mario 64 ) .",1
BrandonGiesing,219740,Recommended,"It's super charming ( story , characters , etc ) , has amazing music , and controls well .",1
Brosocrates,253230,Recommended,"The writing is spot on , the music is incredible , the characters are endearing and memorable , and the gameplays incredibly well .",1
Cade,219740,Recommended,"I hope that anyone who likes the genre , great writing , fantastic music , and genuinely perfect controls picks this up , because they will not be disappointed .",1
Cap'n Alex,238460,Recommended,"What's not to love The gameplay is swift and keeps you on your toes , the controls are easy to learn and are responsive , the story is interesting ( though very confusing , the second game completes the puzzle mostly ) and the aforementioned soundtrack is just the cherry on the top .",1
Carabinx,253230,Recommended,The music One of the funnest games I have played in a long time Easy to play .,1
CheeseCrackers,219740,Recommended,The soundtrack is amazing and so is the gameplay .,1
Chip,219740,Recommended,"I loved every minute of this game the soundtrack , the level design are just fantastic When I get more money I'll probably get the soundtrack because it's just that catchy .",1
Choppytehbear,219740,Recommended,"good Addictive like heroin good just gameplay at walls is better don't Have you ever wanted to manage a colony of psychopaths that create funiture made of human skin , only to be wiped out by a swarm of man hunting yorkshire terriers good Very good too bad Bad Perfect background music .",1
Chunk,238460,Recommended,"Awesome trippy and addictive gameplay and music , definitely recommend buying and playing with a controller .",1
ЩĄ | Killer7,219740,Recommended,Awesome short Indie game with solid gameplay and a amazing music / soundtrack highly recommended B + solid game : ),1
D3THTR00P3R,219150,Recommended,Super addictive and the soundtrack is beast .,1
DarkDachshund,219740,Recommended,"Between the fluid movement , locales filled with collectibles and secrets , memorable characters brimming with personality , and an expansive , euphoric soundtrack , almost everything about the game is nearly flawless .",1
dead54turner,698780,Recommended,some of my fav music and lots of good wholesome fun .,1
DiatheDragon,253230,Recommended,The music is perfect as well as the gameplay .,1
Displeased Duck,219740,Recommended,The music is fantastic and the game provides a great challenge .,1
dnlhrnz,219740,Recommended,"Solidly designed levels , an excellent soundtrack and a main character that controls like a dream .",1
DUDE_,219150,Recommended,"Awesome soundtrack , great gameplay , buy this now",1
Engineer,253230,Recommended,"This game is worth x3 times its price The music is kickass , the gameplay is challenging yet addicting .",1
ErickaUnlimited,253230,Recommended,"You'll scavenge a town run by gangsters , a movie studio , a haunted forest and a foggy alpine mountain range in your quest to locate all your missing time pieces all the while being treated to some of the most marvelous level design and voice acting available .",1
Fides,253230,Recommended,The music was astounding and the levels were great .,1
Foxxys856,4000,Recommended,the gameplay is easy to pick up the music is immersive the easy of the controls,1
Fronkle,219740,Recommended,"Well boy oh boy do I love to be proven wrong on stuff like that This game is amazing It has the controls of Super Mario Odyssey , The movement of Super Mario Sunshine , The feel of Super Mario Galaxy , And the level design of Super Mario 64 / Sunshine All on PC Not to mention the fantastic music and characters I regret doubting this game and was lucky to receive it for free or else I probably would have just shelved it as a failed Mario clone .",1
genkipro,219740,Recommended,"Pros : + In depth survival simulation in an interesting setting , and it's FUN + Excellent game design and balancing + Great music ",1
GetSchmittOn,219740,Recommended,"The controls are smooth and feel natural , the humor is in a great spot where people of all ages can find things to laugh at , the music is fantastic , and the overall story told is a joy to watch unfold .",1
Good Hunter,219740,Recommended,I will not deny that it is a very intense level in terms of sound design and level creation for a survival horror .,1
Gunsaremagic,219740,Recommended,Really awesome 3D platformer it has a big open levels / a great soundtrack / mods / coop / shared / split screen ( good score ) fkin love it,1
Hahe,253230,Recommended,"Really fun with its simple gameplay , the music is awesome .",1
hazzadude,294100,Recommended,It is addicting as hell and is especially fun to play when listening to music .,1
Highzenbirg,219740,Recommended,"Whether you run in guns blazing , or pop in without a sound , the gameplay always seems frantic .",1
I throw rocks at fat girls,238460,Recommended,Probably the most well balanced game ever and the soundtrack is amazing,1
Inner,219740,Recommended,"It has great characters , music , map design , story , etc .",1
Jakaryy,253230,Recommended,"Helps that the voice acting is purposely silly and melodramatic making it more entertaining + The soundtrack is a lot of fun to play along to and even sit back and listen to it separate from the gameplay , well worth buying it + The level design is absolutely awesome It's basically one world divided into small sections and then into levels .",1
Jester,253230,Recommended,"The story , music , gameplay , everything about this game is fantastic .",1
jicky edibles,219150,Recommended,"Love the soundtrack , adventure , events , npcs .",1
Kibs,253230,Recommended,Great music well crafted levels thus far .,1
Mădă,219740,Recommended,"I recommend this game because it's very well realized , the story is great , the narrator's voice is absolutely incredible , the mini games are funny and the end of the game is unexpected and great I want more games created by The Behemoth .",1
marach,219740,Recommended,The music is incredibly thematic and well suited the characters loveable the gameplay and tasks addictive not to mention the plethora of other things you can enjoy in this pleasantly saccharine game .,1
Master_Chief,4000,Recommended,"This game is completely enthralling With an amazing soundtrack , enemies that constantly keep you on the edge of your seat , an amazing difficulty scaling system , and AMZING boss battle that will leave you feeling like you're on top of the world .",1
MetaPixel_,253230,Recommended,"Tl Dr : Cute platformer with really good controls , music , and level design Extremely recommended for fans of games like Super Mario 64 , Banjo Kazooie , Yooka Laylee , Psychonauts , and other colect a ton games , ( good score ) .",1
Mevvallanneous Bob,253230,Recommended,"Moreover , the music is just plain nice to listen to by itself if you're into it Controls : While the controls may take some getting used to ( I use a 360 gamepad for games when it's available ) , that's exactly the ticket .",1
minjanoogle,4000,Recommended,The controls are fluid and soundtrack is amazing .,1
Mispooks,219740,Recommended,"From the levels , Amazing soundtrack , great controls , and Odd characters .",1
Moonjumper,253230,Recommended,Hat Kid is fun to control and the music is just great .,1
Mr. Kill 2,253230,Recommended,"The music is creative and fun to listen to , the characters are of an interesting and entertaining design , the gameplay is pretty solid and reminiscent of Super Mario Sunshine , Super Mario Galaxy , and a hint of the developer's mod for Team Fortress 2 that he developed , Parkour Fortress .",1
nasty nae nae,253230,Recommended,"It has tight controls , an incredible soundtrack , and surprisingly funny dialouge .",1
NatWutz,219150,Recommended,Graphics forget what reality is good Decent look too long at it Gameplay good Addictive like heroin good just gameplay at walls is better don't Audio good good Good too bad Audience good Human PC Requirements if you can run paint good Decent PC NASA if they have a spare computer Difficulty press A brain usage good Easy to learn / Hard to master Souls Grind to grind if u care about leaderboards / ranks good Isnt necessary to progress grind level much grind need a second life for grinding Story or Audio floating around good Awesome replace your life Game Time enough for a cup of tea good To infinity and beyond Price good There is no price the price u have some spare money left recommended could also just burn your money Bugs heard of good Minor bugs get annoying Creed : Unity game itself is a bug,1
NiKaDra,113200,Recommended,"( The entire game + all dlc + soundtrack less than 1 ) You should with no doubt play this awesome game It features hundreds of hours of gameplay for sure , along with an immense amount of bosses and items If this looks good to you I say BUY IT",1
NorseBear,219150,Recommended,Love the music and the gameplay .,1
olivetho,253230,Recommended,"The gameplay strikes just the right balance between simple and complex that I would expect from a game of this type , the characters ( even the bad guys ) are lovable , the soundtrack is amazing : cheery while exploring the level , intense while you're in a boss fight , suspenseful and tense while sneaking around , and when the gameplay is relaxed the music turns into a lullaby so gentle and soothing you wouldn't want to end the level lest the song would end the story is brilliant and the devs have done a wonderful job of telling it through the eyes of a child , and the whole game is filled to the brim with childlike innocence ( well , most of it , but no spoilers ) to the extent of making you feel like you're a child again , taking you on a huge nostalgia trip back to when you were a 6 year old kid , whiling the days away playing super mario or crash bandicoot or spyro the dragon or something else entirely on whatever console you owned at the time , and having that childlike sense of wonder at the most trivial of things and not having to worry about school or money .",1
oscarsoltyk,238460,Recommended,The story is full flavor and the quality of gameplay is multiplied by the outstanding techno and instrumental music .,1
Pahchi,253230,Recommended,"If you even remotely like 3d platformers I strongly recommend A Hat In Time 10 metric tons of charm , super good level design , some of the most fitting music to a game ever and probably one of the best adventures overall in a while",1
Pikachus Bitch Boy,219150,Recommended,This game is ing rad with and epic soundtrack with fast pace and fun bloody gameplay ( good score ) IGN Would Rate Again,1
Pippers,219740,Recommended,"Other than that , this game is amazing and well worth the wait If you love those older styles of platformers you're in for a fun experience with a gorgeous soundtrack that's a delight for the ears .",1
ReptarWillGoOn,219150,Recommended,"Awesome soundtrack Incredible fast paced Intuitive response Rewarding experience Amazing history Hotline Miami made me feel : exhausted , dirty , needing a bath .",1
Robo,219150,Recommended,"I got trapped Judging a book by it's cover , I never thought that this would be an awesome 2'd shooter with an honestly amazing soundtrack and great game physics .",1
Rocking_Star101,253230,Recommended,"The whole experience was one big kawaii / spooky / creepy rollercoster ( in order ) , enhanced by my real life night time atmosphere ( especially once the game started bugging out , if you played the game you know what I mean ) .",1
Salty Bob,219740,Recommended,"For everything it pays homage to , A Hat in Time adds twice as much in creative gameplay mechanics , endearing characters , and a top notch soundtrack .",1
Shearman360,219740,Recommended,"The platforming is great , the characters are great , the music is great , EVERYTHING ABOUT IT IS GREAT Every boss is so good that it feels like the final boss , and then the real final boss comes a long and blows you away A Hat in Time's bosses put Mario's bosses to shame .",1
smahyt,219150,Recommended,"Fast paced gameplay , an incredible soundtrack , and a nice challenge make this game a must play .",1
Soluna,219740,Recommended,"Beneath all the ultraviolence , rock hard gameplay and amazing soundtrack lies a deep story open to interpretation .",1
Spaghetti Lee,253230,Recommended,The soundtrack is unbeatable and the gameplay is phenomenal .,1
sparky boi,105600,Recommended,"I love the music , the weapons , the enemies , and the NPC shop system This is all around amazing",1
Spookeria,219740,Recommended,"Probably the best 3D Platformer currently on the PC Great controls and camera Beautiful level design Charming characters Excellent music Worthwhile collectibles + unlockable perks WORKSHOP SUPPORT it may only have local Coop , but it's still great to enjoy the entire game together with a friend the first DLC was offered for free within the first 24h and offered a great new chapter as well as a few harder challenges from the Snatcher which even give you rewards If you are a fan of 3D Platformers and do not own the game , do yourself a favor and get this game Maybe even if you're not a fan of 3D Platformers .",1
Steven,253230,Recommended,So it makes you always wonder what is going to happen next And let's not talk about the music that this game has you should hear it for yourself 3 If you just should have the basic game but wanted a real challenge Seal the Deal got you coverd with that It makes you think in new ways that you never thought about in the first place and it makes you feel very satisfied once you beat the level itself with our without the extra challenges .,1
Straylow,698780,Recommended,"The music is great , the gameplay is simple yet addictive , and I'm always trying to find new treasures and beat that next boss .",1
Subject153,253230,Recommended,"It is a rock solid , game , with awesome music and gameplay .",1
Sup?,238460,Recommended,"I play this game a little at the moment of writing review , but right now i can say , that the soundtrack is awesome and that gameplay is like hurricane .",1
That Cat from Makura no Danshi,253230,Recommended,"After anticipating this game for years , it was absolutely worth it for it's clean controls , lovable characters , memorable music , and overall charm .",1
ThatKieranChap,238460,Recommended,"The intense gameplay mixed with the heart pounding soundtrack make you feel so powerful but the story makes you feel so vunrable , a pawn in someones scheme .",1
ThatKieranChap,219150,Recommended,"The intense gameplay mixed with the heart pounding soundtrack make you feel so powerful but the story makes you feel so vunrable , a pawn in someones scheme .",1
The Cockatrice,253230,Recommended,( neutral score ) Audio I love it when a game offers a great soundtrack and AHiT does just that .,1
The Cockatrice,253230,Recommended,"Feel free to follow my review page The gist of it : A Hat in Time is a wonderful 3D platformer , filled with great levels , an amazing soundtrack , and a handful of charming characters you'll interact with .",1
The Kid-hearted Gamer,253230,Recommended,"Music : varied and always fitting of the settings , from the chill Mafia Town to the epic * spoiler final level * , but special mention goes to boss music , which leads into : Bosses : Honestly my favorite aspect of the game , there is all of one boss that could be considered average , that being the first against some mooks and an elite mook throwing barrels .",1
Threepw00d,219740,Recommended,"Yes , it feels heavily inspired by that legendary game , and thankfully the devs have done a wonderful job of creating a 3D platformer with tight controls , fun gameplay , awesome music and clever , funny writing .",1
TRONward to Glory!,238460,Recommended,"Such an amazing game Not sure what I like most : soundtrack , gameplay , secrets , challenge , etc .",1
TV,219740,Recommended,Pros : Good soundtrack Diverse and creative level design Platforming around is very satisfying Great characters Very well done dialogue High quality comedy Pretty decent voice acting Mod support ,1
Ultra Paul,219740,Recommended,"BattleBlock Theater is a true quality masterpiece successful in every aspects : Good music Wide humor Fantastic gameplay and puzzles Online worth playing all modes are fun Complete level editor A lot of unlockable costumes / weapons Local co op Yup , they did it Without a doubt , this game deserves a place in every platformer fan's library .",1
vinc,219150,Recommended,Good gameplay and good music .,1
vladde TF:GO,219150,Recommended,"They make the gameplay a lot more enjoyable too , because when you're mowing down enemy after enemy you don't want some slow , bad music in the background .",1
xJose,219740,Recommended,The music was soothing and the gameplay was really peaceful .,1
Yare Yare Daze,219740,Recommended,"Awesome soundtrack , great gameplay , never had so much fun with game in such short period of time .",1
yee haw,219740,Recommended,Pros + Both keyboard and controller friendly ( I used both and found the controls to be crisp on both methods ) + Amazing soundtrack .,1
Yuniac,219740,Recommended,"A Hat In Time is a hat of amazingness , quality , impressiveness , incredibleness and a wow of a game A Hat In Time is a hat of soft , sweet , tuneful and a pleasant to hear a type of music and soundtracks and when things get real the strong cadences get in and heavy rythem introduce itself to us A Hat In Time is a hat of nice , fun and truly enjoyable gameplay with well implemented mechanics all within your hats , a hat in time has so many things to do it will always keep you eager to see what's next and to unlock something new whether its a new hat , a flair for that said Hat or a whole new world with its challanges : ) A Hat In Time is a hat of personalized , unique and incredible voice acting that create a whole story and a background for each character just by the few lines that it says but that can't be achieved without a funny , comedian writing that complete the picture for a hat in time and keeps the journey fresh and amusing I'm thrilled and elated by this game , I had so much fun playing it that I felt sad when I finished it but hoping for more DLCs to come : ) this game is fun and nothing but fun this game is too good to be real .",1
Zanite,253230,Recommended,"This really is one of the most fun games I've ever played , the music in this game is amazing and the controls are so smooth , although you need a pretty good pc to run it , I'd honestly recommend this game to anyone who is bored , It has so much content and is honestly one of my favorite games .",1
zax,219150,Recommended,"It may take him some ( or some more ) tries in the beginning though : ) Add this up with a lovely soundtrack and a DLC that doubles the already vast content and you've got a month , a quarter , maybe even half a year covered .",1
Zetadar,219740,Recommended,"Magnificent , incredibly addictive Rouge like game , randomly generated with dark and humorous themes aswel as great soundtrack and gameplay , isaac is all about luck and skill , aswel as planning ahead , you can't just throw yourself into hordes of enemies without studying their A .",1
sverhrazum,219740,Recommended,"This game is laugh a minute Not to mention great gameplay , sound , e .",1
@uRoN,219740,Recommended,"This game is pretty easy conceptually , but everything looks great , from gameplay to soundtrack .",1
-=Zombine3D=-,219740,Recommended,Pros : Solid and skilled gameplay Fantastic visuals Beautiful soundtrack Actually funny and charming writing,1
